"llsr","23","00010000.tif","23","1","s","","S. 6","1834-05-06","Mr. Robbins, from the Joint Library Committee, reported the following resolution; which was read, and passed to a second reading: Joint Resolution To purchase five hundred copies of the History of Congress, by Carey, Lea, and Blanchard.","Joint Library Committee"
"llsr","23","00020000.tif","23","1","s","","S. 7","1834-05-06","Mr. Robbins, from the Joint Library Committee, reported the following resolution; which was read, and passed to a second reading: Joint Resolution To supply deficiencies in the reports of the decisions of the Supreme Court, the acts of Congress, the public documents furnished to Judges of Territories and other officers.","Joint Library Committee"
"llsr","23","00030000.tif","23","1","s","","S. 14","1834-06-16","Mr. Robbins, from the Committee on Naval Affairs, reported the following resolution; which was read, and passed to a second reading: Joint Resolution Directing the adjustment of the claims of the heirs of the late Robert Fulton.","Committee on Naval Affairs"
"llsr","23","00040002.tif","23","1","s","2","S. 14","1834-06-16","",""
"llsr","23","00050000.tif","23","2","s","","S. 4","1834-12-15,1835-01-12","Agreeably to notice, Mr. Robbins asked and obtained leave to introduce the following resolution; which was read twice, and referred to the Committee on the Library. Joint Resolution To purchase five hundred copies of the History of Congress, by Carey, Lea, and Blanchard.","Committee on the Library"
"llsr","23","00060000.tif","23","2","s","","S. 17","1835-02-02,1835-02-03,1835-02-11","Introduced, on leave, by Mr. Benton; read, and passed to a second reading. Read a second time, and referred to the Committee on the Judiciary. Committee discharged from the further consideration of this resolution. A Joint Resolution To repeal the resolutions heretofore adopted for the election of public printers.","Committee on the Judiciary"
